Object,xmin,ymin,xmax,ymax,below_object,below_dist,below_obj_index,side_object,side_length,side_obj_index,revised_distances_vert,revised_distances_hori,text_extraction
noiph,125,83,312,116,ngayph,35.0,1,CNXH,217.5,4,35.0,217.5,ĐẢNG BỘ CÔNG AN TRUNG ƯƠNG ĐẢNG ỦY TRƯỜNG ĐH CSND
ngayph,259,124,505,145,tenvb,46.0,3,,0.0,-1,46.0,0.0,"Thành phố Hồ Chí Minh, ngày 23 tháng 5 năm 2023"
sovb,165,124,248,145,tenvb,46.0,3,ngayph,175.5,1,46.0,175.5,SỐ 33 -KH/ĐU
tenvb,190,156,460,205,khongxd,265.0,5,,0.0,-1,265.0,0.0,Tronhà Tham gia Giải báo chí toàn quốc về xây dựng Đảng (Giải búa liềm vàng) lần thứ VIII - năm 2023
CNXH,321,53,551,106,ngayph,55.0,1,,0.0,-1,-1.0,0.0,ĐẢNG CỘNG SẢN VIỆT NAM
khongxd,116,217,531,674,,0.0,-1,,0.0,-1,0.0,0.0,"Thực hiện Kế hoạch số 180-KH/ĐUCA, ngày 12/4/2023 của Đảng ủy CATW về Trongianh tham gia Giải báo chí toàn quốc về xây dựng Đảng (Giải búa liêm vàng) lần thứ VIII - Trong năm năm 2023 trong CAND, Đảng ủy Trường xây dựng Kê hoạch triển khai thực hiện tại triều Đảng bộ trường như sau: L MỤC ĐÍCH, YÊU CẦU 1. Mục đích - Tiếp tục khẳng định vị trí, vai trò và tầm quan trọng của công tác xây dựng Đảng trong hệ thống chính trị; góp phần xây dựng Đảng trong sạch vững mạnh; ngân Tronhing ch c, c c chặn, đầy lùi sự suy thoái về tư tưởng chính trị, đạo đứi sông và những biêu hiện ""tự diễn biến"", ?tự chuyển hóa? trong nội bộ. 198 - Tăng cường sự quan tâm, trách nhiệm của cả cán bộ, chiến sĩ, đảng viên Nhà Ng Trongianh trường đối với công tác xây dựng Đảng; nằng cao chất lượng công tác thông tin, ctiều nhọc Trongiánh tuyên truyền về xây dựng Đảng trên các phương tiện thông tin đại chúng. - Thông qua Giải báo chí toàn quốc về xây dựng Đảng tiếp tục cổ vũ, động viên Xãiến t c th                            ên tích cực tham gia xây dựng Đảng; : đông thời, tồn vinh các nhàyên Thưnh thuy tác giả, nhóm tác giả, tác phẩm và các tập thế, cá nhân có nhiều đóng góp trong hoạt động tuyên truyền về xây dựng Đảng. 2. Yêu cầu Nhiếnh traiên Các đảng bộ, chi bộ động viên cản bộ, đảng viên, học viên tích cực tham ging n Giải báo chí toàn quốc về xây dựng Đảng. II. NỘI DUNG 1. Quy định về tác giả, tác phẩm dự thi Về tác giả: % Toàn thế cán bộ, đảng viên, chiến sĩ, học viên Nhà trường, Tác giả tham dự Trườnh tray Giải không vi phạm các quy định về đạo đức nghề nghiệp của người làm báo Việt Việt Thiến Nanh Nam, không vi phạm Luật Báo chí, Luật Sở hữu trí tuệ và các quy định khác của th n pháp luật."
