Object,xmin,ymin,xmax,ymax,below_object,below_dist,below_obj_index,side_object,side_length,side_obj_index,revised_distances_vert,revised_distances_hori,text_extraction
noiph,127,81,316,116,ngayph,26.5,1,CNXH,223.0,4,26.5,223.0,ĐẢNG BỘ CÔNG AN TRUNG ƯƠNG ĐẢNG ỦY TRƯỜNG ĐHCSND
ngayph,278,114,496,136,tenvb,40.5,3,,0.0,-1,-1.0,0.0,"TP. Hồ Chí Minh, ngày 28 tháng 3 năm 2023"
sovb,172,121,252,139,tenvb,35.5,3,ngayph,175.0,1,35.5,175.0,
tenvb,138,148,491,183,khongxd,276.0,5,,0.0,-1,276.0,0.0,KẾ HOẠCH 1
CNXH,324,57,565,104,ngayph,44.5,1,,0.0,-1,-1.0,0.0,ĐẢNG CỘNG SẢN VIỆT NAM
khongxd,121,206,515,677,,0.0,-1,,0.0,-1,0.0,0.0,"Xã nh tronghthực hiện Kế hoạch số 176-KH/ĐUCA, ngày 14/3/24/3/2023 của Đảng uy Chính Tri ng tr cen a an Trung ương về công tác tuyên giáo trong Công an nhân dân nam ZV23, Dànllyên nănhĩang Trương chiến củyên ủy trường Đại học CSND ban hành Kê hoạch công tác tuyen giao trong Danyopophi chọc Trường Đại học CSND năm 2023, như sau: I- MỤC ĐÍCH, YÊU CẦU 1.Quán triệt, triển khai thực hiện nghiêm túc, hiệu quả các nhiệm vụ, giai Cáo ngianhọ p pháo xây dưng Đảng về chính trị, tư tưởng, đạo đức trong Nghị quyet Đại nại Trongiang của Đảng, các nghị quyết, chỉ thị, kết luận của Trung ương ve xay cựng, cnnh Nhưng đồn Đảng, học tập và làm theo tư tưởng, đạo đức, phong cách Ho Chi Minh, ngn] Trong thuy quyết đại hội đảng cấp trên và nghị quyết Đại hội Đa Đa bộ Trương Dại nọc oND. 2. Các cấp ủy, tổ chức đảng, trước hết là bí thư cấp ủy phải tập trung lãnh xã th c đạo, chỉ đạo, chỉ đao tổ chức thực hiện nghiêm túc, hiệu quả, với quyenh trị cao, xã th ch t tạnh tạo sự chuyển biển rỗ rệt, thực chất trong công tác tuyên giáo, gop phan xay dựng Xãi Đảng, xây dựng lực lượng CAND trong sạch, vững mạnh II- NHIỆM VỤ 1. Công tác tư tưởng - Tổ chức tốt việc nghiên cứu, học tập, quán triệt, tuyên truyên các văn kiện Nhưngiang của Đảng, tập trung vào Nghị quyết Hội nghị lần thứ bảy, Hội nghị lần thư tam Tronhậnginh Ban Chấp hành Trung ương khóa XIII, Coi trọng sử dụng đội ngũ bao cao viên, người Xã ng thuật chuyên gia, giảng viên Khoa Lý luận chính trị và Khoa học xã hội nhân văn, Khoa Xã ch Ng Luật và Khoa Nghiệp vụ cơ bản tham gia quản triệt các nghị quyet, chỉ thị, Ket ngingiện luận, quy định của Đảng - Tiếp tục thực hiện Nghị quyết số 37-NQ/TW, ngày 09/10/2014 của Bộ Chưnhọiện Chính trị về công tác lý luận và định hướng nghiên cứu đến năm 2030; Quy định nhànăm Trường thungingin 2 số 285-QĐ/TW, ngày 24/5/2015 của Bộ Chính trị về dân chủ trong nghiên cứu lý Xãiên luận chính trị trong các cơ quan Đảng, Nhà nước; Kết luận số 94-KL/TW, ngày Trường nh th n 2 2 28/3/2014 của Ban Bí thư về tiếp tục đối mới học tập lý luận chính trị trong hệ Troảngian t thống giáo dục quốc dân và Quy định số 57-QĐ/TW, ngày 08.02/22022 của Bangàn Trường t t Bí thư về đổi tượng, tiêu chuân và phân cấp đảo tạo lý luận chính trị, To chức toi th"
