Object,xmin,ymin,xmax,ymax,below_object,below_dist,below_obj_index,side_object,side_length,side_obj_index,revised_distances_vert,revised_distances_hori,text_extraction
noiph,79,49,239,91,sovb,38.5,2,CNXH,265.0,4,38.5,265.0,BỘ CÔNG AN TRƯỜNG ĐẠI HỌC CSND
ngayph,266,100,567,127,tenvb,47.0,3,,0.0,-1,47.0,0.0,"Thành phố Hồ Chí Minh, ngày 24 tháng 10 năm 2022"
sovb,102,96,213,121,tenvb,52.0,3,ngayph,259.0,1,-1.0,259.0,Số:341S/KH-TOS
tenvb,165,133,479,188,khongxd,329.0,5,,0.0,-1,329.0,0.0,KẾ HOẠCH Tổ chức phong trào thi đua ?Xây dựng môi trường văn hóa trong báo chí? tại Trường Đại học CSND
CNXH,273,49,575,92,ngayph,43.0,1,,0.0,-1,43.0,0.0,CỘNG HÒA XÃ HỘI CHỦ NGHĨA VIỆT NAM Độc lập - Tự do - Hạnh phúc
khongxd,73,197,571,782,,0.0,-1,,0.0,-1,0.0,0.0,"Thực hiện Kế hoạch số 466/KH-BCA-X04, ngày 21/9/2022 của Bộ Công an về việc thực hiện phong trào thi đua ?Xây dựng môi trường văn hóa trong các cơ quan báo chí CAND"", Ban Giám hiệu ban hành Kế hoạch tổ chức phong trào thi đua ""Xây dựng môi trường văn hóa trong báo chí"""" tại Trường Đại học CSND với những nội dung như sau: I. MỤC ĐÍCH, YÊU CẦU 1. Mục đích Nâng cao nhận thức, trách nhiệm của cán bộ, giảng viên, học viên về vị trí, tầm quan trọng của văn hóa đối với sự phát triển đất nước nói chung, báo chí nói riêng; giá trị của sản phẩm báo chí và danh dự, uy tín của người làm báo và xây dựng môi trường văn hóa báo chí tại Trường. Thúc đẩy Tạp chí KHGD CSND thực hiện tốt vai trò, sứ mệnh của mình trong công tác báo chí, góp phần xây dựng và phát triển nền văn hóa Việt Nam tiên tiến, đậm đà bản sắc dân tộc. 2. Yêu cầu Các đơn vị, trung đội, đoàn thể tổ chức thực hiện nghiêm túc các nội dung theo Kế hoạch. Cán bộ, học viên nêu cao tinh thần trách nhiệm, ra sức thi đua lập thành tích cao nhất Việc thực hiện phong trào thi đua phải duy trì thường xuyên, liên tục, thiết xã thực, hiệu quả tạo thành nề nếp trong đơn vị, trung đội, đoàn thể. II. NỘI DUNG 1.Các đơn vị, trung đội, đoàn thể tổ chức quán triệt sâu sắc, triển khai nghiêm túc phong trào thi đua gắn với phong trào thi đua ?Cán bộ, công chức, viên chức thi đua thực hiện văn hóa công sở? và xây dựng ? Đơn vị văn hóa, gương mẫu chấp hành điều lệnh CAND"", Quán triệt nêu cao tịnh thần, ý thức trách nhiệm, nâng cao nhận thức của cán bộ, giảng viên, học viên về vai trò, trách nhiệm của báo chí cách mạng việt nam trong sự nghiệp xây dựng, bảo vệ tổ quốc. 2. Tham gia tích cực, hiệu quả việc xây dựng môi trường văn hóa trong đơn vị, trung đội, đoàn thể, ứng xử văn hóa trong công tác, học tập và hình thành các sản phẩm tạp chí, kỷ yếu hội thảo,... giàu chất văn hóa, Đồng thời, đầu tư các tác  báo chí,.. do cơ quan Trung ương tổ chức."
