Object,xmin,ymin,xmax,ymax,below_object,below_dist,below_obj_index,side_object,side_length,side_obj_index,revised_distances_vert,revised_distances_hori,text_extraction
noiph,85,74,237,111,sovb,34.5,2,CNXH,243.5,4,34.5,243.5,BỘ CÔNG AN TRƯỜNG ĐẠI HỌC CSND
ngayph,268,113,533,132,tenvb,56.0,3,,0.0,-1,-1.0,0.0,
sovb,105,117,212,137,tenvb,51.5,3,ngayph,242.0,1,51.5,242.0,Số: 1007/QyĐ-T05
tenvb,118,157,504,200,khongxd,301.5,5,,0.0,-1,301.5,0.0,"QUY ĐỊNH Triềngin (Công tác thi đua, khen thường tai Trường Đại học Canh sat nhân Quan Thọnội"
CNXH,257,38,552,105,ngayph,51.0,1,,0.0,-1,51.0,0.0,CÔNG HÒA XÃ HỘI CHỦ NGHĨA VIỆT NAM Độc lập - Tự do - Hạnh phúc
khongxd,87,207,563,753,,0.0,-1,,0.0,-1,0.0,0.0,"Trongián ch Căn cúc Thông tu số 12/2019/TT:BCA, ngày 29/5/2019 của Bộ trưởng Bộ Cong an Troành Trườnh ta quy quy đinh công tác thi đua, khen thưởng trong Công an nhan dâm, chươn Xãn cứ Quyết đinh số 2059/0Đ-BCA, ngày 24/3/2020 của Bộ trương Bọ Công an anh đinh chức năng, nhiêm vụ, quyền hạn và tổ chức bọ may của 19 may cua nương Đại học Cảnh sát nhân dân - Theo đề nghị của trưởng phònghính trị; Trongiang Hiệu trưởng Trường Đại học CSND ban hành Quy định công tác in1 aua, ngiều ng khen thường tại trường Đại học CSND Chương I QUY ĐỊNH CHUNG Điều 1. Phạm vi điều chinh, đối tượng áp dụng 1. Phạm vi điều chỉnh Nhước Qua Ow đình này auy đỉnh về tổ chức thì đua, danh hiệu và tiêu chuân danh niệu tiên chọc Nhướchinh thì đưana Hải đồng thì đua khen thường, nội dung tiêu chỉ, thang cham diên un ngườinginh Thung thiên âm tiêu chuân hồ sơ đề nohi, xét tăng danh hiệu thìệu va, khoi thioi thì qua trong winh ""nhính ch c ng t nho nhong trào tha """" ""Vì an ninh Tô quốc"" - nội dung, tiêu ch1, ho sơ, quy uninging th ng th thunh xãiếng t t đề nghi xét tăng giấy khen, biểu dương, phê bình đôi với tập thc, cả nhân thuộc nhiền Trường Đại học CSND 2. Đối tượng áp dụng 20 th - Cá nhân: Cán bộ, giảng viên, lao động hợp đông và học viên dang cong tác, học tập tại tRƯỜNG ĐẠi Học CSND. Tân thể: Phòng Khòa, Thoa, Trung tâm, Công hoàn, Đoàn thanh niên, họi phụ nư Truy và Trung đội học viên thuộc Trường Đại học CSND. Điều 2. Nguyên tắc thi đua, khen thưởng 1 Khen thưởng phải phù hợp với tính chất từng loại thánh tích, tương xưng nhưngiáo với kết quả đạt được hoặc mức độ công lao, đồng góp, công hiếnn cua từng tạp tnc, cá nhân. 2000 thíchoặc hoặc lân được thành tích trong điều kiện khó khăn, phức tạp thì q tược knen tnưvng ne nen tuving ở mức hạng cao hơn."
